{
  "name": "Joko",
  "ign": "frostbite",
  "team": "crimson-wolves",
  "role": "Support",
  "country": "Indonesia",
  "bio": "Support player for Crimson Wolves. Great utility usage.",
  "socials": {},
  "stats": {
    "kills": 98,
    "deaths": 120,
    "assists": 89,
    "matchesPlayed": 15,
    "mvpCount": 1
  }
}