{
  "name": "Bayu",
  "ign": "viper99",
  "team": "crimson-wolves",
  "role": "IGL / Rifler",
  "country": "Indonesia",
  "bio": "In-game leader for Crimson Wolves. Calm under pressure.",
  "socials": {},
  "stats": {
    "kills": 134,
    "deaths": 110,
    "assists": 72,
    "matchesPlayed": 15,
    "mvpCount": 3
  }
}