{
  "name": "Andi",
  "ign": "reaper01",
  "team": "black-ops",
  "role": "Entry Fragger",
  "country": "Indonesia",
  "bio": "Aggressive entry player, first into every site.",
  "socials": {},
  "stats": {
    "kills": 156,
    "deaths": 134,
    "assists": 55,
    "matchesPlayed": 15,
    "mvpCount": 2
  }
}