{
  "name": "Dimas",
  "ign": "shadowz",
  "team": "black-ops",
  "role": "Sniper",
  "country": "Indonesia",
  "bio": "Primary AWPer for Black Ops. Exceptional long-range accuracy.",
  "socials": {
    "discord": "shadowz"
  },
  "stats": {
    "kills": 189,
    "deaths": 115,
    "assists": 43,
    "matchesPlayed": 16,
    "mvpCount": 3
  }
}