{
  "name": "Rizki",
  "ign": "rikkun159",
  "team": "black-ops",
  "role": "IGL / Rifler",
  "country": "Indonesia",
  "bio": "Team captain and in-game leader for Black Ops. Known for strategic calls and consistent aim.",
  "socials": {
    "discord": "rikkun159",
    "youtube": "@rikkun159"
  },
  "stats": {
    "kills": 248,
    "deaths": 102,
    "assists": 67,
    "matchesPlayed": 16,
    "mvpCount": 5
  }
}